<?xml version="1.0" encoding="UTF-8"?>
<xs:schema xmlns:xs="http://www.w3.org/2001/XMLSchema">

  <xs:element name="restaurant">
    <xs:complexType>
      <xs:sequence>
        <xs:element name="name" type="xs:string"/>
        <xs:element name="address">
          <xs:complexType>
            <xs:sequence>
              <xs:element name="street" type="xs:string"/>
              <xs:element name="city" type="xs:string"/>
              <xs:element name="state" type="xs:string"/>
              <xs:element name="zipcode" type="xs:string"/>
            </xs:sequence>
          </xs:complexType>
        </xs:element>
        <xs:element name="phone" type="xs:string"/>
        <xs:element name="email" type="xs:string"/>
        <xs:element name="website" type="xs:string"/>
        <xs:element name="hours" maxOccurs="unbounded">
          <xs:complexType>
            <xs:sequence>
              <xs:element name="day" type="xs:string"/>
              <xs:element name="open" type="xs:string"/>
              <xs:element name="close" type="xs:string"/>
            </xs:sequence>
          </xs:complexType>
        </xs:element>
        <xs:element name="menu">
          <xs:complexType>
            <xs:sequence>
              <xs:element name="category" maxOccurs="unbounded">
                <xs:complexType>
                  <xs:sequence>
                    <xs:element name="item" maxOccurs="unbounded">
                      <xs:complexType>
                        <xs:sequence>
                          <xs:element name="name" type="xs:string"/>
                          <xs:element name="description" type="xs:string"/>
                          <xs:element name="price" type="xs:string"/>
                        </xs:sequence>
                      </xs:complexType>
                    </xs:element>
                  </xs:sequence>
                  <xs:attribute name="name" type="xs:string" use="required"/>
                </xs:complexType>
              </xs:element>
            </xs:sequence>
          </xs:complexType>
        </xs:element>
      </xs:sequence>
    </xs:complexType>
  </xs:element>

</xs:schema>
